{
  "schema_version": "prompt-pipeline-task-scope.v1",
  "scope_id": "prompt-quality-scope.program-activation.v1",
  "program_id": "PROMPT-QUALITY-MIGRATION-EXECUTION-PROGRAM",
  "task_id": "PROMPT-QUALITY-PROGRAM-ACTIVATION",
  "repository": "rezahh107/Prompt-Pipeline",
  "base_branch": "main",
  "base_sha": "25bd3af631c17fbfda76a3cabcaa612dfdc11143",
  "head_binding": {"mode": "ci_runtime_exact_head", "head_sha": null},
  "change_class": "program_activation",
  "risk_tier": "medium",
  "scope_mode": "exact_files",
  "scope_revision": "sha256:e32f465fb177f6058b7f397ec9016fcaf199f5d3596c8e3e8733230e4c33d0b7",
  "committed_paths": [
    "package.json",
    "planning/NEXT_WORK.md",
    "planning/PROMPT_QUALITY_EXECUTION_PLAN.md",
    "planning/prompt-quality/current-scope.json",
    "planning/prompt-quality/diagnostics/prompt-quality-diagnostics.v1.json",
    "planning/prompt-quality/fixtures/adversarial.json",
    "planning/prompt-quality/fixtures/invalid.json",
    "planning/prompt-quality/fixtures/valid.json",
    "planning/prompt-quality/impacts/0001-PROMPT-QUALITY-PROGRAM-ACTIVATION.json",
    "planning/prompt-quality/lifecycle/PROMPT-QUALITY-PROGRAM-ACTIVATION.ledger.json",
    "planning/prompt-quality/prompt-quality-execution-program.v1.json",
    "planning/prompt-quality/schemas/prompt-pipeline-lifecycle-ledger.v1.schema.json",
    "planning/prompt-quality/schemas/prompt-pipeline-progress-impact.v1.schema.json",
    "planning/prompt-quality/schemas/prompt-pipeline-task-scope.v1.schema.json",
    "planning/prompt-quality/schemas/prompt-quality-execution-program.v1.schema.json",
    "planning/prompt-quality/scopes/PROMPT-QUALITY-PROGRAM-ACTIVATION.scope.json",
    "scripts/peac-prompt-quality-governance.mjs",
    "scripts/prompt-quality-governance/core.mjs",
    "scripts/prompt-quality-governance/fixtures-program-scope.mjs",
    "scripts/prompt-quality-governance/fixtures-progress-lifecycle.mjs",
    "scripts/prompt-quality-governance/fixtures.mjs",
    "scripts/prompt-quality-governance/lifecycle.mjs",
    "scripts/prompt-quality-governance/program.mjs",
    "scripts/prompt-quality-governance/scope-progress.mjs"
  ],
  "allowed_generated_paths": [],
  "excluded_work": ["substantive implementation of PPQR-001","substantive implementation of PPQR-002","substantive implementation of PPQR-003","substantive implementation of PPQR-004","substantive implementation of PPQR-005","substantive implementation of PPQR-006","substantive implementation of PPQR-007","substantive implementation of PPQR-008","substantive implementation of PPQR-009","substantive implementation of PPQR-010","substantive implementation of PPQR-011","substantive implementation of PPQR-012","substantive implementation of PPQR-013","substantive implementation of PPQR-014","substantive implementation of PPQR-015"],
  "deferred_not_deleted": ["PPQR-001","PPQR-002","PPQR-003","PPQR-004","PPQR-005","PPQR-006","PPQR-007","PPQR-008","PPQR-009","PPQR-010","PPQR-011","PPQR-012","PPQR-013","PPQR-014","PPQR-015"],
  "depends_on": [],
  "required_outputs": [
    "planning/NEXT_WORK.md",
    "planning/PROMPT_QUALITY_EXECUTION_PLAN.md",
    "planning/prompt-quality/diagnostics/prompt-quality-diagnostics.v1.json",
    "planning/prompt-quality/impacts/0001-PROMPT-QUALITY-PROGRAM-ACTIVATION.json",
    "planning/prompt-quality/lifecycle/PROMPT-QUALITY-PROGRAM-ACTIVATION.ledger.json",
    "planning/prompt-quality/prompt-quality-execution-program.v1.json",
    "planning/prompt-quality/scopes/PROMPT-QUALITY-PROGRAM-ACTIVATION.scope.json",
    "scripts/peac-prompt-quality-governance.mjs",
    "scripts/prompt-quality-governance/core.mjs",
    "scripts/prompt-quality-governance/fixtures-program-scope.mjs",
    "scripts/prompt-quality-governance/fixtures-progress-lifecycle.mjs",
    "scripts/prompt-quality-governance/fixtures.mjs",
    "scripts/prompt-quality-governance/lifecycle.mjs",
    "scripts/prompt-quality-governance/program.mjs",
    "scripts/prompt-quality-governance/scope-progress.mjs"
  ],
  "completion_evidence": ["schema validation","deterministic cross-field validation","exact fixture diagnostic sets","CI wiring","exact diff reconciliation","exact-head CI"],
  "authorized_operations": ["create bounded planning/prompt-quality governance artifacts","create one deterministic governance validator","add package scripts to existing pnpm CI chain","create repository memory authorities"],
  "forbidden_changes": ["modify domains/**","modify policies/**","modify pipeline routing or intake authorities","modify templates or generated prompt semantics","integrate Promptfoo or any execution harness","execute or add model calls","add semantic judges","add shadow execution","change production routing","retire legacy paths","upgrade dependencies","change workflow permissions","change repository settings","merge or enable auto-merge","publish deploy or release","implement substantive PPQR-001 through PPQR-015 deliverables"],
  "amendments": [{
    "revision": "sha256:0da9d74537684c80fa0ce173b3fc912b47be9fe1bd6095395a231c3af73cdda8",
    "previous_revision": "sha256:d85e0e87334b335d9f0ff87ca0eb1e26029632c27841a169959eacaf66e3e11f",
    "reason": "Split the deterministic governance validator into small composable repository-native modules before any module path is created.",
    "authorization_commit_sha": "871ebe58929ed59f9346dda2820781b1e4a2f7f5",
    "added_paths": ["scripts/prompt-quality-governance/core.mjs","scripts/prompt-quality-governance/program.mjs","scripts/prompt-quality-governance/scope-progress.mjs","scripts/prompt-quality-governance/lifecycle.mjs","scripts/prompt-quality-governance/fixtures-program-scope.mjs","scripts/prompt-quality-governance/fixtures-progress-lifecycle.mjs","scripts/prompt-quality-governance/fixtures.mjs"]
  }]
}
